{"match_id": "0022500261", "start_time_utc": "2025-11-20T01:00:00", "home_team": "Oklahoma City Thunder", "away_team": "Sacramento Kings", "preds": {"rt": {"home": 0.8805, "draw": 0.0124, "away": 0.107}, "ft": {"home": 0.8872, "away": 0.1128}, "mu": {"home": 128.6138, "away": 109.9387}, "std": {"home": 10.6462, "away": 12.0082}, "hcp": [{"hcp": -10.5, "prob": 0.7016}, {"hcp": -9.5, "prob": 0.7237}, {"hcp": -8.5, "prob": 0.745}, {"hcp": -7.5, "prob": 0.7653}, {"hcp": -6.5, "prob": 0.7848}, {"hcp": -5.5, "prob": 0.8032}, {"hcp": -4.5, "prob": 0.8207}, {"hcp": -3.5, "prob": 0.8372}, {"hcp": -2.5, "prob": 0.8527}, {"hcp": -1.5, "prob": 0.8671}, {"hcp": -0.5, "prob": 0.8805}, {"hcp": 0.5, "prob": 0.893}, {"hcp": 1.5, "prob": 0.9045}, {"hcp": 2.5, "prob": 0.915}, {"hcp": 3.5, "prob": 0.9247}, {"hcp": 4.5, "prob": 0.9335}, {"hcp": 5.5, "prob": 0.9414}, {"hcp": 6.5, "prob": 0.9486}, {"hcp": 7.5, "prob": 0.9551}, {"hcp": 8.5, "prob": 0.9609}, {"hcp": 9.5, "prob": 0.9661}, {"hcp": 10.5, "prob": 0.9707}], "ou": [{"points": 220.5, "prob": 0.8402}, {"points": 221.5, "prob": 0.8264}, {"points": 222.5, "prob": 0.8119}, {"points": 223.5, "prob": 0.7966}, {"points": 224.5, "prob": 0.7807}, {"points": 225.5, "prob": 0.7641}, {"points": 226.5, "prob": 0.7468}, {"points": 227.5, "prob": 0.7288}, {"points": 228.5, "prob": 0.7102}, {"points": 229.5, "prob": 0.6911}, {"points": 230.5, "prob": 0.6714}]}}