{"match_id": "0022501149", "start_time_utc": "2026-04-07T23:30:00", "home_team": "Boston Celtics", "away_team": "Charlotte Hornets", "preds": {"rt": {"home": 0.5605, "draw": 0.0354, "away": 0.4041}, "ft": {"home": 0.5962, "away": 0.4038}, "mu": {"away": 111.042, "home": 114.6574}, "std": {"away": 11.3429, "home": 12.3656}, "hcp": [{"hcp": -10.5, "prob": 0.3153}, {"hcp": -9.5, "prob": 0.3405}, {"hcp": -8.5, "prob": 0.3665}, {"hcp": -7.5, "prob": 0.3931}, {"hcp": -6.5, "prob": 0.4202}, {"hcp": -5.5, "prob": 0.4476}, {"hcp": -4.5, "prob": 0.4754}, {"hcp": -3.5, "prob": 0.5032}, {"hcp": -2.5, "prob": 0.531}, {"hcp": -1.5, "prob": 0.5587}, {"hcp": -0.5, "prob": 0.5861}, {"hcp": 0.5, "prob": 0.6131}, {"hcp": 1.5, "prob": 0.6396}, {"hcp": 2.5, "prob": 0.6654}, {"hcp": 3.5, "prob": 0.6904}, {"hcp": 4.5, "prob": 0.7146}, {"hcp": 5.5, "prob": 0.7378}, {"hcp": 6.5, "prob": 0.7601}, {"hcp": 7.5, "prob": 0.7812}, {"hcp": 8.5, "prob": 0.8013}, {"hcp": 9.5, "prob": 0.8202}, {"hcp": 10.5, "prob": 0.8379}], "ou": [{"points": 220.5, "prob": 0.6088}, {"points": 221.5, "prob": 0.589}, {"points": 222.5, "prob": 0.569}, {"points": 223.5, "prob": 0.5488}, {"points": 224.5, "prob": 0.5285}, {"points": 225.5, "prob": 0.5081}, {"points": 226.5, "prob": 0.4877}, {"points": 227.5, "prob": 0.4673}, {"points": 228.5, "prob": 0.447}, {"points": 229.5, "prob": 0.4269}, {"points": 230.5, "prob": 0.407}, {"points": 231.5, "prob": 0.3873}, {"points": 232.5, "prob": 0.3679}, {"points": 233.5, "prob": 0.3488}, {"points": 234.5, "prob": 0.3301}, {"points": 235.5, "prob": 0.3119}, {"points": 236.5, "prob": 0.2941}, {"points": 237.5, "prob": 0.2768}, {"points": 238.5, "prob": 0.26}, {"points": 239.5, "prob": 0.2438}, {"points": 240.5, "prob": 0.2281}]}}